{
  "key":"agenda","name":"Agenda e Agendamentos","category":"operacao","version":"0.1.0","status":"planned","description":"Agenda compartilhada para compromissos, reservas, servicos e disponibilidade.","requires":["core-base","cadastro"],"provides":["agenda","agendamentos","disponibilidade","lembretes"],"commercial":{"sellable":true,"standalone":false,"audience":["pequenos-negocios","servicos","clinicas","saloes"]},"integration":{"entities":["appointment","availability","resource"],"events":["appointment.created","appointment.updated","appointment.cancelled"]},"notes":["Deve reutilizar pessoas do modulo Cadastro."]
}
