{
  "key":"documentos","name":"Documentos","category":"gestao","version":"0.1.0","status":"planned","description":"Gestao de documentos, anexos, modelos, validade, categorias e vinculos com clientes e processos.","requires":["core-base","cadastro"],"provides":["documentos","anexos","modelos","validade-documental"],"commercial":{"sellable":true,"standalone":false,"audience":["pequenos-negocios","associacoes","clinicas","escolas"]},"integration":{"entities":["document","document_template","attachment"],"events":["document.created","document.updated","document.expiring"]},"notes":["Armazenamento deve respeitar isolamento por tenant e politicas de acesso."]
}
