{
  "key":"atendimento","name":"Atendimentos","category":"gestao","version":"0.1.0","status":"planned","description":"Registro e acompanhamento de atendimentos, historico, observacoes, status e responsaveis.","requires":["core-base","cadastro"],"provides":["atendimentos","historico","status-atendimento","responsaveis-atendimento"],"commercial":{"sellable":true,"standalone":false,"audience":["pequenos-negocios","associacoes","clinicas","projetos-sociais"]},"integration":{"entities":["service_case","service_note","service_status"],"events":["service_case.created","service_case.updated","service_case.closed"]},"notes":["Nao duplicar dados de pessoas; referenciar o modulo Cadastro."]
}
