{
  "key":"whatsapp","name":"WhatsApp e Mensagens","category":"comunicacao","version":"0.1.0","status":"planned","description":"Mensageria integrada para contatos, notificacoes, lembretes, templates e historico de comunicacao.","requires":["core-base","cadastro"],"provides":["mensagens","templates","notificacoes","historico-comunicacao"],"commercial":{"sellable":true,"standalone":false,"audience":["pequenos-negocios","prestadores-servicos","comercio","associacoes"]},"integration":{"entities":["message","message_template","conversation"],"events":["message.queued","message.sent","message.delivered","message.failed"]},"notes":["Integracao com provedor deve ser desacoplada e configuravel por tenant."]
}
