{
  "key":"orcamentos","name":"Orcamentos e Propostas","category":"comercial","version":"0.1.0","status":"planned","description":"Criacao, envio e acompanhamento de orcamentos e propostas vinculados a clientes e oportunidades.","requires":["core-base","cadastro"],"provides":["orcamentos","propostas","itens-orcamento","status-proposta"],"commercial":{"sellable":true,"standalone":false,"audience":["pequenos-negocios","prestadores-servicos","comercio"]},"integration":{"entities":["quote","quote_item","proposal"],"events":["quote.created","quote.sent","quote.approved","quote.rejected"]},"notes":["Pode integrar com CRM, Financeiro e Ordem de Servico sem depender deles para operar."]
}
